{
  "schema_version": "ssr.answer-run-record.v1",
  "run_id": "run-2026-0002",
  "message_id": "msg-2026-0002",
  "started_at": "2026-10-17T09:31:01Z",
  "completed_at": "2026-10-17T09:31:04Z",
  "status": "completed",
  "context_snapshot_id": "ctx-2026-0042",
  "query_executions": [
    { "query_id": "query-2026-0002", "query_type": "game_item", "status": "ok" },
    { "query_id": "query-2026-0003", "query_type": "weather", "status": "unavailable" }
  ],
  "gap_record_ids": ["gap-2026-0001"]
}
